{
  "id": "1f2a3b4c-5d6e-4f7a-9b0c-1d2e3f4a5b6c",
  "type": "telemetry.enriched",
  "source": "telemetry-ingest",
  "time": "2025-01-15T08:31:12Z",
  "data": {
    "bus_id": "3f6b8f2e-7a1c-4d5b-9e0a-1b2c3d4e5f60",
    "ts": "2025-01-15T08:31:10Z",
    "speed_kph": 32.5,
    "h2_level_pct": 64.2,
    "fuel_cell_kw": 78.4,
    "battery_soc_pct": 71.0,
    "odometer_km": 18234.6,
    "lat": 52.5201,
    "lon": 13.405,
    "route_id": "R-12",
    "depot_id": "riverside",
    "heading_deg": 143.0
  }
}
